[
  {
    "id": "sebi.mii",
    "regulator": "SEBI",
    "label": "Market Infrastructure Institution",
    "parent": "body_corporate",
    "description": "CSCRF category name read from the SEBI circular. Thresholds and included entity types are not yet modelled.",
    "version": "1.0",
    "valid_from": "2024-08-20",
    "valid_to": null
  },
  {
    "id": "sebi.qualified_re",
    "regulator": "SEBI",
    "label": "Qualified Regulated Entity",
    "parent": "body_corporate",
    "description": "CSCRF category name read from the SEBI circular. Thresholds and included entity types are not yet modelled.",
    "version": "1.0",
    "valid_from": "2024-08-20",
    "valid_to": null
  },
  {
    "id": "sebi.midsize_re",
    "regulator": "SEBI",
    "label": "Mid-size Regulated Entity",
    "parent": "body_corporate",
    "description": "CSCRF category name read from the SEBI circular. Thresholds and included entity types are not yet modelled.",
    "version": "1.0",
    "valid_from": "2024-08-20",
    "valid_to": null
  },
  {
    "id": "sebi.small_re",
    "regulator": "SEBI",
    "label": "Small-size Regulated Entity",
    "parent": "body_corporate",
    "description": "CSCRF category name read from the SEBI circular. Thresholds and included entity types are not yet modelled.",
    "version": "1.0",
    "valid_from": "2024-08-20",
    "valid_to": null
  },
  {
    "id": "sebi.selfcert_re",
    "regulator": "SEBI",
    "label": "Self-certification Regulated Entity",
    "parent": "body_corporate",
    "description": "CSCRF category name read from the SEBI circular. Thresholds and included entity types are not yet modelled.",
    "version": "1.0",
    "valid_from": "2024-08-20",
    "valid_to": null
  }
]
